<!ELEMENT carta (plato)*>
  <!ELEMENT plato (nombre,precio,descripcion,calorias)>
  
  <!--DeclaraciÃ³n de los elementos-->
  <!ELEMENT nombre (#PCDATA)>
  <!ELEMENT precio (#PCDATA)>
  <!ELEMENT descripcion (#PCDATA)>
  <!ELEMENT calorias (#PCDATA)>

  <!ATTLIST precio moneda CDATA #REQUIRED>